{
  "schemaVersion": 1,
  "generatedAt": "2026-08-24T13:45:47.700Z",
  "policy": {
    "sourceMaxAtRuntime": false,
    "verifiedInterchangeOnly": true,
    "lod0Role": "immutable high-fidelity master",
    "defaultRuntimeTarget": "lod1",
    "mobileRuntimeTarget": "lod2",
    "maxUncompressedGlbBytes": 41943040
  },
  "assets": [
    {
      "id": "yueyang",
      "nameCN": "岳阳楼",
      "source": {
        "path": "3D资产/岳阳楼/3d66.com_22732580.max",
        "sha256": "29312a494e1da917f30d18b4f5e7e199ffdee52eb77d331b514be47fc2b5dcf4",
        "faces": 1329613
      },
      "runtime": {
        "loader": "createYueyangTowerFormModel",
        "defaultTier": "lod1",
        "tiers": {
          "lod0": {
            "purpose": "hero/master",
            "status": "ready",
            "files": [
              {
                "url": "/assets/yueyang-architectural-lod.glb",
                "gltfVersion": 2,
                "bytes": 24278972,
                "sha256": "cf49502df431b7e40bc34d62576e938f0a9ba756aabb984f82e923fe20a18884",
                "meshCount": 311,
                "primitiveCount": 601,
                "triangles": 494282,
                "materialCount": 10,
                "compression": {
                  "meshopt": false
                },
                "extensionsUsed": [
                  "KHR_materials_specular"
                ],
                "extensionsRequired": []
              }
            ],
            "totals": {
              "bytes": 24278972,
              "meshes": 311,
              "primitives": 601,
              "triangles": 494282,
              "materials": 10
            }
          },
          "lod1": {
            "purpose": "desktop/default",
            "status": "ready",
            "files": [
              {
                "url": "/assets/yueyang-architectural-lod1.glb",
                "gltfVersion": 2,
                "bytes": 9140308,
                "sha256": "0688c32e93e1b0d90ac1de12de8494531de051a91966fa54f32a3f7669a74eb3",
                "meshCount": 324,
                "primitiveCount": 614,
                "triangles": 417940,
                "materialCount": 10,
                "compression": {
                  "meshopt": true
                },
                "extensionsUsed": [
                  "EXT_meshopt_compression",
                  "KHR_materials_specular"
                ],
                "extensionsRequired": [
                  "EXT_meshopt_compression"
                ]
              }
            ],
            "totals": {
              "bytes": 9140308,
              "meshes": 324,
              "primitives": 614,
              "triangles": 417940,
              "materials": 10
            }
          },
          "lod2": {
            "purpose": "mobile/far",
            "status": "ready",
            "files": [
              {
                "url": "/assets/yueyang-architectural-lod2.glb",
                "gltfVersion": 2,
                "bytes": 8716772,
                "sha256": "4a8822b924ed34211dd3f88f3912a684731d8b5a60dcc6f94ea6c235889204c6",
                "meshCount": 324,
                "primitiveCount": 614,
                "triangles": 389904,
                "materialCount": 10,
                "compression": {
                  "meshopt": true
                },
                "extensionsUsed": [
                  "EXT_meshopt_compression",
                  "KHR_materials_specular"
                ],
                "extensionsRequired": [
                  "EXT_meshopt_compression"
                ]
              }
            ],
            "totals": {
              "bytes": 8716772,
              "meshes": 324,
              "primitives": 614,
              "triangles": 389904,
              "materials": 10
            }
          }
        }
      }
    },
    {
      "id": "huanghe",
      "nameCN": "黄鹤楼",
      "source": {
        "path": "3D资产/黄鹤楼/3d66.com_20515822.max",
        "sha256": "a9010b69742c44a4c71a315c75eb5b713672753c14764c83ff4c8de2731a0664",
        "faces": 2987155
      },
      "runtime": {
        "loader": "createHuangheTowerHighModel",
        "defaultTier": "lod1",
        "tiers": {
          "lod0": {
            "purpose": "hero/master",
            "status": "ready",
            "files": [
              {
                "url": "/assets/huanghe-main-tower-highmodel.glb",
                "gltfVersion": 2,
                "bytes": 73981736,
                "sha256": "78772bc6ca1e47c1fd7622ccfbb9d3952958c4a446c905f3ba9fc5d9aa8e5aeb",
                "meshCount": 11,
                "primitiveCount": 11,
                "triangles": 2776514,
                "materialCount": 11,
                "compression": {
                  "meshopt": true
                },
                "extensionsUsed": [
                  "EXT_meshopt_compression",
                  "KHR_materials_specular"
                ],
                "extensionsRequired": [
                  "EXT_meshopt_compression"
                ]
              }
            ],
            "totals": {
              "bytes": 73981736,
              "meshes": 11,
              "primitives": 11,
              "triangles": 2776514,
              "materials": 11
            }
          },
          "lod1": {
            "purpose": "desktop/default",
            "status": "ready",
            "files": [
              {
                "url": "/assets/huanghe-main-tower-lod1.glb",
                "gltfVersion": 2,
                "bytes": 62489364,
                "sha256": "9042a09da4852cbe55a417e306a98e04bc7daebf1d749df0a70a17df3e6c7000",
                "meshCount": 11,
                "primitiveCount": 11,
                "triangles": 2394103,
                "materialCount": 11,
                "compression": {
                  "meshopt": true
                },
                "extensionsUsed": [
                  "EXT_meshopt_compression",
                  "KHR_materials_specular"
                ],
                "extensionsRequired": [
                  "EXT_meshopt_compression"
                ]
              }
            ],
            "totals": {
              "bytes": 62489364,
              "meshes": 11,
              "primitives": 11,
              "triangles": 2394103,
              "materials": 11
            }
          },
          "lod2": {
            "purpose": "mobile/far",
            "status": "ready",
            "files": [
              {
                "url": "/assets/huanghe-main-tower-lod2.glb",
                "gltfVersion": 2,
                "bytes": 41504396,
                "sha256": "5113e7706b92439b7abd1db2a099ee1bf1c263d5842a73d57a415b3c032c66d5",
                "meshCount": 11,
                "primitiveCount": 11,
                "triangles": 1368513,
                "materialCount": 11,
                "compression": {
                  "meshopt": true
                },
                "extensionsUsed": [
                  "EXT_meshopt_compression",
                  "KHR_materials_specular"
                ],
                "extensionsRequired": [
                  "EXT_meshopt_compression"
                ]
              }
            ],
            "totals": {
              "bytes": 41504396,
              "meshes": 11,
              "primitives": 11,
              "triangles": 1368513,
              "materials": 11
            }
          }
        }
      }
    },
    {
      "id": "tengwang",
      "nameCN": "滕王阁",
      "source": {
        "path": "3D资产/滕王阁/3d66.com_13009910.max",
        "sha256": "4885ccf621a4cd32c5bf6fa51bce19d0d1cda1039a191675cd3722ad6ae1a506",
        "faces": 5148034
      },
      "runtime": {
      "loader": "createTengwangTowerHighModel",
      "defaultTier": "master",
        "tiers": {
          "lod0": {
            "purpose": "hero/master (offline-baked web derivative of tengwang-22753718.glb)",
            "status": "ready",
            "files": [
              {
                "url": "/assets/tengwang-high-precision/tengwang-master-web.glb",
                "gltfVersion": 2,
                "bytes": 84234016,
                "sha256": "57b60014ca133cf338d383a334fe83ddd0f8f4cae502d826d3fc58e07f015aac",
                "meshCount": 1374,
                "primitiveCount": 1454,
                "triangles": 2960154,
                "materialCount": 55,
                "compression": {
                  "meshopt": true
                },
                "extensionsUsed": [
                  "EXT_meshopt_compression",
                  "KHR_materials_specular",
                  "KHR_mesh_quantization"
                ],
                "extensionsRequired": [
                  "EXT_meshopt_compression",
                  "KHR_mesh_quantization"
                ]
              }
            ],
            "totals": {
              "bytes": 84234016,
              "meshes": 1374,
              "primitives": 1454,
              "triangles": 2960154,
              "materials": 55
            }
          },
          "lod1": {
            "purpose": "desktop/default",
            "status": "ready",
            "files": [
              {
                "url": "/assets/tengwang-main-tower-lod1.glb",
                "gltfVersion": 2,
                "bytes": 8894000,
                "sha256": "33bd352f3a7847b284a594d43e65bc3ef94afd9a76f2adeeaf4d9cd9d290c184",
                "meshCount": 17,
                "primitiveCount": 17,
                "triangles": 110216,
                "materialCount": 17,
                "compression": {
                  "meshopt": true
                },
                "extensionsUsed": [
                  "EXT_meshopt_compression",
                  "KHR_materials_specular"
                ],
                "extensionsRequired": [
                  "EXT_meshopt_compression"
                ]
              }
            ],
            "totals": {
              "bytes": 8894000,
              "meshes": 17,